列ID,列名,分组,是否核心因子,有效样本数,均值
ID00186284,罗布河块：产量：力拓集团（季度）,供应-产量,是,3767,2741.260950
ID00186285,罗布河块：销售数量：力拓集团（以股份占比计）（季度）,供应-矿山,是,3767,1198.195912
ID00186286,罗布河块：销售数量：力拓集团（季度）,供应-矿山,是,3767,2260.794001
ID00186408,铁精粉：85%Fe：销售数量：澳大利亚必和必拓集团（季度）,供应-矿山,是,3760,44339.180319
ID00186666,铁矿石：产量：澳大利亚必和必拓集团：100%股权（季度）,供应-产量,是,3756,69754.685570
ID00186669,铁矿石：产量：巴西北方地区：巴西淡水河谷公司（季度）,供应-产量,是,3761,43970.398830
ID00186670,铁矿石：产量：巴西东南地区：巴西淡水河谷公司（季度）,供应-产量,是,3764,21000.167109
ID00186671,铁矿石：产量：巴西南方地区：巴西淡水河谷公司（季度）,供应-产量,是,3760,16153.018085
ID00186683,铁矿石：加工量：福蒂斯丘金属集团（季度）,价格-矿石价格,否,3764,45.767163
ID00186684,铁矿石：产量：力拓集团（以股份占比计）（季度）,供应-产量,是,3763,71207.844273
ID00186985,铁矿石：销售量合计：澳大利亚必和必拓集团（季度）,供应-矿山,是,3758,61970.072911
ID00186990,铁矿石：销售量合计：全球：巴西淡水河谷公司（季度）,供应-矿山,是,3762,79655.081340
ID00187000,铁矿石：销售数量：中华人民共和国：巴西淡水河谷公司（季度）,供应-矿山,是,3762,48555.760234
ID00187001,铁矿石：销售量合计：力拓集团：力拓皮尔巴拉矿区（季度）,供应-矿山,是,3761,82100.584419
ID00187002,铁矿石：销售量合计：力拓集团（季度）,供应-矿山,是,3762,86561.217172
ID00187017,巴西淡水河谷公司：销售数量：铁矿石（除原矿）（季度）,供应-矿山,是,3763,68.415009
ID00313193_quarter,世界钢铁工业协会：高炉生铁：产量：全球（季度）,供应-产量,否,3761,314134.236373
ID00392622,铁矿石：产量：力拓皮尔巴拉矿区（季度）,供应-产量,是,3764,82156.297024
ID01155774_quarter,铁矿石：发货量：澳大利亚联邦：力拓集团（季度）,供应-发货量,是,2759,8088.650616
ID01155776_quarter,铁矿石：发货量：澳大利亚联邦：福蒂斯丘金属集团（季度）,供应-发货量,否,2757,4581.900686
ID01434259,球团矿：销售数量：全球：巴西淡水河谷公司（季度）,供应-矿山,是,3398,9927.995586
ID01562389_quarter,超特粉：到港量：47个港口：福蒂斯丘金属集团：明细（季度）,供应-到港,否,1853,1671.641662
ID01562396_quarter,PB块：到港量：47个港口：力拓集团：明细（季度）,供应-到港,是,1854,1590.179612
ID01562397_quarter,PB粉：到港量：47个港口：力拓集团：明细（季度）,供应-到港,是,1853,3446.868645
ID01565061_quarter,铁矿石：到港量：47个港口（季度）,供应-到港,否,1588,31521.307368
ID01879051,铁矿石：加工量：铁桥项目：福蒂斯丘金属集团（季度）,价格-矿石价格,否,1311,0.969092
ID02039108_quarter,铁矿石：澳大利亚联邦产区：发货量（季度）,供应-发货量,否,2497,22980.174089
ID02039109_quarter,铁矿石：澳大利亚联邦产区：发货量：澳大利亚联邦→中华人民共和国（季度）,供应-发货量,否,2124,19657.014972
IO_SHIP_EST_AUS_017_quarter,铁矿石非主流矿山到中国发运（季度）,供应-发运,否,2129,10291.874578
IO_SHIP_EST_GLOB_006_quarter,铁矿石全球发中国总量（季度）,价格-矿石价格,否,2126,31762.363301
IO_SHIP_VOL_CTF_014_quarter,铁矿石超特粉发中国（季度）,价格-矿石价格,否,2672,1492.171744
IO_SHIP_VOL_GLOB_016_quarter,铁矿石淡水河谷发中国总量（季度）,供应-矿山,是,2218,4479.605249
IO_SHIP_VOL_PBB_011_quarter,铁矿石PB块发中国（季度）,价格-矿石价格,否,2672,1402.353978
IO_SHIP_VOL_PBF_009_quarter,铁矿石PB粉发中国（季度）,价格-矿石价格,否,2671,2660.310906
M0039354,中国：GDP：不变价：当季同比,宏观-GDP,否,3781,5.638297
RE00034182_quarter,卡拉加斯粉：发货量：巴西联邦共和国：明细（季度）,供应-发货量,否,2579,4126.762621
RE00035602_quarter,超特粉：发货量：澳大利亚联邦：明细（季度）,供应-发货量,否,2670,1633.253858
RE00035610_quarter,PB块：发货量：澳大利亚联邦：明细（季度）,供应-发货量,否,2674,1757.018923
RE00035620_quarter,PB粉：发货量：澳大利亚联邦：明细（季度）,供应-发货量,否,2673,3315.506322
G0000236,全球：GDP：不变价：同比,宏观-GDP,否,3785,3.462157
ID00186565_year,铁矿石：发货量：澳大利亚必和必拓集团→中华人民共和国（年度）,供应-发货量,是,3777,22979.755128
ID00186566_year,铁矿石：发货量：巴西淡水河谷公司→全球（年度）,供应-发货量,是,3775,28964.298527
ID00186567_year,铁矿石：发货量：福蒂斯丘金属集团→中华人民共和国（年度）,供应-发货量,否,3772,16508.555875
ID00186568_year,铁矿石：发货量：力拓集团→中华人民共和国（年度）,供应-发货量,是,3773,25570.097464
ID00313193_year,世界钢铁工业协会：高炉生铁：产量：全球（年度）,供应-产量,否,3773,1251386.015107
ID01155774_year,铁矿石：发货量：澳大利亚联邦：力拓集团（年度）,供应-发货量,是,2685,32068.638994
ID01155776_year,铁矿石：发货量：澳大利亚联邦：福蒂斯丘金属集团（年度）,供应-发货量,否,2683,17197.510026
ID01562389_year,超特粉：到港量：47个港口：福蒂斯丘金属集团：明细（年度）,供应-到港,否,1586,6449.159647
ID01562396_year,PB块：到港量：47个港口：力拓集团：明细（年度）,供应-到港,是,1586,6405.541173
ID01562397_year,PB粉：到港量：47个港口：力拓集团：明细（年度）,供应-到港,是,1586,13908.010467
ID01565061_year,铁矿石：到港量：47个港口（年度）,供应-到港,否,1589,119909.583512
IO_SHIP_EST_AUS_017_year,铁矿石非主流矿山到中国发运（年度）,供应-发运,否,1952,38473.763860
IO_SHIP_VOL_CTF_014_year,铁矿石超特粉发中国（年度）,价格-矿石价格,否,2682,5269.120833
IO_SHIP_VOL_GLOB_016_year,铁矿石淡水河谷发中国总量（年度）,供应-矿山,是,1951,18040.131903
IO_SHIP_VOL_PBB_011_year,铁矿石PB块发中国（年度）,价格-矿石价格,否,2682,5156.304325
IO_SHIP_VOL_PBF_009_year,铁矿石PB粉发中国（年度）,价格-矿石价格,否,2684,9901.511218
RE00034182_year,卡拉加斯粉：发货量：巴西联邦共和国：明细（年度）,供应-发货量,否,2316,16688.446632
RE00035602_year,超特粉：发货量：澳大利亚联邦：明细（年度）,供应-发货量,否,2683,5834.984178
RE00035610_year,PB块：发货量：澳大利亚联邦：明细（年度）,供应-发货量,否,2683,6357.313045
RE00035620_year,PB粉：发货量：澳大利亚联邦：明细（年度）,供应-发货量,否,2684,12216.153689
